20762,hrsa nursing scholarship,0.119,20762,hrsa nursing scholarship,0.119,20762,hrsa nursing scholarship,,20762,hrsa nursing scholarship give suck learnedness erudition,,20762,hrsa give suck learnedness erudition,,20762,hrsa nursing scholarship scholarly,,20762,hrsa nursing scholarly,0.0097,20762,hrsa nursing scholarship oly      box cw   care graduate,0.0536,20762,oly      box cw   care graduate,0.0,20762,hrsa nursing scholarship Health Resources and Services Administration Nursing Scholarship,,20965,Ritz Camera Centers,,20762,hrsa nursing scholarship,,20762,hrsa nursing scholarship,0.119,20762,hrsa nursing scholarship,0.119,20762,hrs nur scholarship,0.0,20762,hrsa nurs schol,0.0004,20762,hrsa nurs scholarship,0.0554,20762,hrsa nurs scholarship,0.0554,20762,hrsa nursing scholarship,0.119,20762,hrsa nurs scho,0.0,20762,hrsa nursi schol,0.0004,20762,hrsa repay underserv clinician nurs profess loan scholarship percent workforc,0.0009,20762,hrsa nursing scholarship,0.119,20762,hrsa nursing scholarship,0.119,20762,hrsa nursing scholarship,0.119
20764,green darner dragonfly,0.2352,20764,green darner dragonfly,0.2352,20764,green darner dragonfly,,20764,green darner dragonfly K common devil s darning needle mosquito hawk,,20764,green darner dragonfly,,20764,green darner dragonfly yellow blue red bluet clubtail bluetail damselfly butterfly,,20764,yellow blue red bluet clubtail bluetail damselfly butterfly,0.0135,20764,green darner dragonfly red purple mangxamba gahsh aeshnidae,0.262,20764,red purple mangxamba gahsh aeshnidae,0.0278,20764,green darner dragonfly Green darner Dragonfly,,20967,SEAL Team Six,,20764,green darner dragonfly,,20764,green darner dragonfly,0.2352,20764,green darn dragonfly,0.1335,20764,green darner dragonf,0.1896,20764,green darn dragonf,0.0006,20764,green darner dragonfli,0.2352,20764,green darner dragonfli,0.2352,20764,green darner dragonfly,0.2352,20764,gree darn drag,0.0,20764,green darne drago,0.0,20764,dragonfli rhionaeschna wing blue ei green skimmer aeshna california darner,0.0646,20764,green darner dragonfly,0.2352,20764,green darner dragonfly,0.2352,20764,green darner dragonfly,0.2352
20766,prescription diet pills,0.0078,20766,prescription diet pills,0.0078,20766,prescription diet pills,,20766,prescription diet pills,,20766,prescription diet pills,,20766,prescription diet pills medication prescribing dietary nutrition medication medications,,20766,medication prescribing dietary nutrition medication medications,0.0,20766,prescription diet pills medications eating medications,0.019,20766,medications eating medications,0.0,20766,prescription diet pills Medical prescription Anti obesity medication,,20969,Oregon,,20766,prescription prescription drug diet pills pill,,20766,prescription drug diet pill,0.0012,20766,prescription diet pill,0.0078,20766,prescript dies pil,0.0,20766,prescrib diet pil,0.0003,20766,prescript diet pill,0.0078,20766,prescript diet pill,0.0078,20766,prescription diet pill,0.0078,20766,pres diet pill,0.0,20766,presc diet pills,0.0012,20766,pharmaci carisoprodol pill diet drug soma cheap weight prescript phentermin,0.0,20766,prescription diet pills,0.0078,20766,prescription diet pills,0.0078,20766,prescription diet pills,0.0078
20768,mileage tax credit,0.2299,20768,mileage tax credit,0.2299,20768,mileage tax credit,,20768,mileage tax credit gasoline mileage fuel consumption rate gas mileage revenue enhancement assess task recognition citation cite,,20768,gasoline mileage fuel consumption rate gas mileage revenue enhancement assess task recognition citation cite,,20768,mileage tax credit milage taxation debit,,20768,milage taxation debit,0.0,20768,mileage tax credit flier mpg income loans banks,0.0084,20768,flier mpg income loans banks,0.0,20768,mileage tax credit Road pricing,,20973,Ohio Washington metropolitan area,,20768,mileage tax credit recognition,,20768,mileage tax recognition,0.0071,20768,mileage tax credit,0.2299,20768,mile tac credit,0.0,20768,mil tax credit,0.0,20768,mileag tax credit,0.2299,20768,mileag tax credit,0.2299,20768,mileage tax credit,0.2299,20768,mile tax cred,0.0,20768,milea tax credi,0.0,20768,incom credit tax pdf mile jmb expens vehicl mileag taxpay ir,0.0821,20768,mileage tax credit,0.2299,20768,mileage tax credit,0.2299,20768,mileage tax credit,0.2299
20771,newport university california,0.25,20771,newport university california,0.25,20771,newport university california,,20771,newport university california CA Calif  Golden State,,20771,newport university CA Calif  Golden State,,20771,newport university california eastbourne oxfordshire clifton college campus florida texas arizona,,20771,eastbourne oxfordshire clifton college campus florida texas arizona,0.0,20771,newport university california rhode r i  professor graduate calif  oregon,0.0,20771,rhode r i  professor graduate calif  oregon,0.0,20771,newport university california Newport  Wales University of Wales  Newport California,,20975,Michaels Handicraft Retail,,20771,newport university california,,20771,newport university california,0.25,20771,newport university california,0.25,20771,newport univers californ,0.0,20771,newport univers californ,0.0,20771,newport univers california,0.0,20771,newport univers california,0.0,20771,newport university california,0.25,20771,newp univ cali,0.0,20771,newpo unive calif,0.0,20771,park univers packag hotel disneyland museum newport resort law california beach,0.0,20771,newport university california,0.25,20771,newport university california,0.25,20771,newport university california,0.25
20772,bree olson,,20772,bree olson,,20772,bree olson,,20772,bree olson,,20772,bree olson,,20772,bree olson carlin hogg goff mcintosh jeffery swanson,,20772,carlin hogg goff mcintosh jeffery swanson,,20772,bree olson nuhv waysh piyanart srivalo,,20772,nuhv waysh piyanart srivalo,,20772,bree olson Bree Olson,,20976,Sudoku,,20772,bree olson,,20772,bree olson,,20772,bree olson,,20772,bre olson,,20772,bre olson,,20772,bree olson,,20772,bree olson,,20772,bree olson,,20772,bree olso,,20772,bree olson,,20772,olson cock movi galleri porn dvd babe fuck bree blond,,20772,bree olson,,20772,bree olson,,20772,bree olson,
20773,football,0.011,20773,football,0.011,20773,football,,20773,football football game,,20773,football game,,20773,football soccer,,20773,soccer,0.0,20773,football soccer basketball,0.0,20773,soccer basketball,0.0,20773,football Association football,,20978,William Clark,,20773,football,,20773,football,0.011,20773,football,0.011,20773,footbal,0.011,20773,footbal,0.011,20773,footbal,0.011,20773,footbal,0.011,20773,football,0.011,20773,foot,0.0,20773,footb,0.0,20773,colleg cup footbal helmet club leagu fantasi bet shirt retro,0.0,20773,football,0.011,20773,football,0.011,20773,football,0.011
20774,extreme dating,0.0139,20774,extreme dating,0.0139,20774,extreme dating,,20774,extreme dating,,20774,extreme dating,,20774,extreme dating severe radio carbon,,20774,severe radio carbon,0.0,20774,extreme dating instance,0.0,20774,instance dating,0.0,20774,extreme dating EX treme Dating,,20985,Referee Darts,,20774,extreme extreme point dating go steady,,20774,extreme point go steady,0.0,20774,extreme date,0.0139,20774,extrem dat,0.0,20774,extrem dat,0.0,20774,extrem date,0.0139,20774,extrem date,0.0139,20774,extreme dating,0.0139,20774,extr dati,0.0,20774,extre datin,0.0,20774,sfw hot extrem avg pm    funni date execut desc tag,0.0,20774,extreme dating,0.0139,20774,extreme dating,0.0139,20774,extreme dating,0.0139
20776,nissan pickup gas mileage,0.0,20776,nissan pickup gas mileage,0.0,20776,nissan pickup gas mileage,,20776,nissan pickup gas mileage Nisan pickup truck tone arm cartridge vaunt accelerator pedal natural gas gasoline mileage fuel consumption rate gas mileage,,20776,nissan pickup gas mileage,,20776,nissan pickup gas mileage hyundai renault chrysler pick up pick ups gases oil milage,,20776,hyundai renault chrysler pick up pick ups gases oil milage,0.0,20776,nissan pickup gas mileage mazda toyota truck natural gasoline flier mpg,0.0,20776,mazda toyota truck natural gasoline flier mpg,0.0,20776,nissan pickup gas mileage Nissan Navara Fuel economy in automobiles,,20991,Hostage Rescue Team,,20776,nissan nisan pickup tone arm gas natural gas mileage,,20776,nisan tone arm natural gas mileage,0.0,20776,nissan pickup gas mileage,0.0,20776,nissan pickup ga mile,0.0,20776,niss pickup gas mil,0.0,20776,nissan pickup ga mileag,0.0,20776,nissan pickup gas mileag,0.0,20776,nissan pickup gas mileage,0.0,20776,niss pick gas mile,0.0,20776,nissa picku gas milea,0.0,20776,altima ga nissan car hybrid ram dodg truck mileag pickup,0.0,20776,nissan pickup gas mileage,0.0,20776,nissan pickup gas mileage,0.0,20776,nissan pickup gas mileage,0.0
20777,spain weather conditions,0.0034,20777,spain weather conditions,0.0034,20777,spain weather conditions,,20777,spain weather conditions,,20777,Espana Kingdom of Spain brave brave out weather condition precondition train,,20777,spain weather conditions portugal britain england inclement climate conditons,,20777,portugal britain england inclement climate conditons,0.0,20777,spain weather conditions portugal spanish inclement rainy result,0.0062,20777,portugal spanish inclement rainy result,0.0,20777,spain weather conditions Spain,,20994,The Oregonian Newspaper,,20777,spain weather conditions condition,,20777,spain weather condition,0.0034,20777,spain weather conditions,0.0034,20777,spain weather condit,0.0034,20777,spain weath condit,0.0,20777,spain weather condit,0.0034,20777,spain weather condit,0.0034,20777,spain weather condition,0.0034,20777,spai weat cond,0.0,20777,spain weath condi,0.0,20777,portug weather climat hotel europ low forecast condit tenerif island spain,0.0,20777,spain weather conditions,0.0034,20777,spain weather conditions,0.0034,20777,spain weather conditions,0.0034
20781,exercises to lose weight,,20781,exercises lose weight,,20781,exercises lose weight,,20781,exercises to lose weight,,20781,work example usage misplace miss free weight,,20781,exercises lose weight excercises lost weight,,20781,excercises lost weight,,20781,exercises lose weight maneuvers lost load,,20781,maneuvers lost load,,20781,exercises lose weight Physical exercise Weight loss,,20996,Guillermo Venegas Lloveras,,20781,exercises use to lose suffer weight,,20781,use to suffer weight,,20781,exercises to lose weight,,20781,exercis to los weight,,20781,exerc to los weight,,20781,exercis to lose weight,,20781,exercis to lose weight,,20781,exercise to lose weight,,20781,exer to lose weig,,20781,exerc to lose weigh,,20781,tip fast exercis lose diet calori weight item fat loss,,20781,exercises to lose weight,,20781,exercises to lose weight,,20781,exercises lose weight,
20783,tewksbury mass,0.0359,20783,tewksbury mass,0.0359,20783,tewksbury mass,,20783,tewksbury mass bulk stack,,20783,tewksbury mass,,20783,tewksbury mass mass,,20783,tewksbury mass,0.0359,20783,tewksbury mass ooooooooooooooooooooooooooooooooooooooo myoot indeed,0.0208,20783,ooooooooooooooooooooooooooooooooooooooo myoot indeed,0.0,20783,tewksbury mass Tewksbury  Massachusetts,,20999,Detroit Osteopathic medicine in the United States,,20783,tewksbury mass multitude,,20783,tewksbury multitude,0.0343,20783,tewksbury mass,0.0359,20783,tewksbur mas,0.0,20783,tewksbury mass,0.0359,20783,tewksburi mass,0.0359,20783,tewksburi mass,0.0359,20783,tewksbury mass,0.0359,20783,tewk mass,0.0,20783,tewks mass,0.0,20783,ma tewksburi credit massachusett chil union dj pic billerica mass wed,0.0175,20783,tewksbury mass,0.0359,20783,tewksbury mass,0.0359,20783,tewksbury mass,0.0359
20785,warrant officer,0.1998,20785,warrant officer,0.1998,20785,warrant officer,,20785,warrant officer stock warrant countenance stock purchase warrant policeman ship s officer military officer,,20785,warrant officer,,20785,warrant officer warrent sergeant,,20785,warrent sergeant,0.0052,20785,warrant officer arrest sergeant,0.0157,20785,arrest sergeant,0.0,20785,warrant officer Warrant officer,,21000,Mothers Against Drunk Driving Michigan Victimology,,20785,warrant officer policeman,,20785,warrant policeman,0.0,20785,warrant officer,0.1998,20785,war officer,0.0003,20785,war off,0.0,20785,warrant offic,0.1998,20785,warrant offic,0.1998,20785,warrant officer,0.1998,20785,warr offi,0.0,20785,warra offic,0.0,20785,class commiss wo rank armi appoint warrant royal sergeant offic arrest,0.1493,20785,warrant officer,0.1998,20785,warrant officer,0.1998,20785,warrant officer,0.1998
20786,bbq rubs,0.0791,20786,bbq rubs,0.0791,20786,bbq rubs,,20786,bbq rubs,,20786,bbq fray hang up wipe,,20786,bbq rubs barbeque barbecue,,20786,barbeque barbecue rubs,0.0,20786,bbq rubs barbecue barbeque,0.0,20786,barbecue barbeque rubs,0.0,20786,bbq rubs Barbecue Spice rub,,21532,Styles Bridges Michigan,,20786,bbq rubs rub,,20786,bbq rub,0.0791,20786,bbq rub,0.0791,20786,bbq rub,0.0791,20786,bbq rub,0.0791,20786,bbq rub,0.0791,20786,bbq rub,0.0791,20786,bbq rub,0.0791,20786,bbq rubs,0.0791,20786,bbq rubs,0.0791,20786,gift dry bbq barbecu recip season sauc grill rub rib,0.0033,20786,bbq rubs,0.0791,20786,bbq rubs,0.0791,20786,bbq rubs,0.0791
20795,all earthquake list,0.2426,20795,earthquake list,0.1902,20795,earthquake list,,20795,all earthquake list,,20795,seism quake inclination name number,,20795,earthquake list quake list,,20795,quake list,0.0,20795,earthquake list quake temblor,0.0,20795,quake temblor list,0.0,20795,earthquake list,,21593,Rutledge  Georgia,,20795,all earthquake list tilt,,20795,all earthquake tilt,0.0,20795,all earthquake list,0.2426,20795,al earthquak list,0.0,20795,al earthquak list,0.0,20795,all earthquak list,0.2426,20795,all earthquak list,0.2426,20795,all earthquake list,0.2426,20795,all eart list,0.0,20795,all earth list,0.0,20795,     all list           epicent sichuan chines landslid kangd china earthquak,0.3064,20795,all earthquake list,0.2426,20795,all earthquake list,0.2426,20795,earthquake list,0.1902
20796,poseidon industries,0.0,20796,poseidon industries,0.0,20796,poseidon industries,,20796,poseidon industries diligence,,20796,poseidon diligence,,20796,poseidon industries aphrodite titus anastasia sectors companies,,20796,aphrodite titus anastasia sectors companies,0.0,20796,poseidon industries zeus athena sectors,0.0,20796,zeus athena sectors,0.0,20796,poseidon industries Poseidon Stone tool,,21745,Almera,,20796,poseidon industries industry,,20796,poseidon industry,0.0,20796,poseidon industry,0.0,20796,poseidon industr,0.0,20796,poseidon industry,0.0,20796,poseidon industri,0.0,20796,poseidon industri,0.0,20796,poseidon industry,0.0,20796,pose indu,0.0,20796,posei indus,0.0,20796,water ballroom ship adventur dvd oil poseidon industri ye separ film,0.0,20796,poseidon industries,0.0,20796,poseidon industries,0.0,20796,poseidon industries,0.0
20797,firefly bus,0.2328,20797,firefly bus,0.2328,20797,firefly bus,,20797,firefly bus Pyrophorus noctiluca fire beetle jitney autobus,,20797,firefly bus,,20797,firefly bus luciferase luciferin buses busses,,20797,luciferase luciferin buses busses,0.0,20797,firefly bus js   k      buses train,0.2387,20797,js   k      buses train,0.0,20797,firefly bus Firefly  airline  Transit bus,,22952,Rosary,,20797,firefly bus busbar,,20797,firefly busbar,0.0001,20797,firefly bus,0.2328,20797,firef bus,0.0001,20797,firef bus,0.0001,20797,firefli bu,0.2328,20797,firefli bus,0.2328,20797,firefly bus,0.2328,20797,fire bus,0.0,20797,firef bus,0.0001,20797,australia memori hotel airlin selangor firefli kuala buse bu cach,0.0012,20797,firefly bus,0.2328,20797,firefly bus,0.2328,20797,firefly bus,0.2328
20799,riverbend park,0.2601,20799,riverbend park,0.2601,20799,riverbend park,,20799,riverbend park parkland parking lot car park,,20799,riverbend parkland parking lot car park,,20799,riverbend park parkland,,20799,riverbend parkland,0.0051,20799,riverbend park kd   kd   adjacent,0.0,20799,kd   kd   adjacent,0.0,20799,riverbend park Riverbend Park,,23912,Collegeville  Pennsylvania,,20799,riverbend park parking lot,,20799,riverbend parking lot,0.1338,20799,riverbend park,0.2601,20799,riverbens park,0.0,20799,riverbend park,0.2601,20799,riverbend park,0.2601,20799,riverbend park,0.2601,20799,riverbend park,0.2601,20799,rive park,0.0,20799,river park,0.0,20799,left park onto scout alton calgari riverbend river     anim,0.064,20799,riverbend park,0.2601,20799,riverbend park,0.2601,20799,riverbend park,0.2601
20803,kentucky lemon law,0.3764,20803,kentucky lemon law,0.3764,20803,kentucky lemon law,,20803,kentucky lemon law,,20803,Bluegrass State KY Citrus limon maize gamboge legal philosophy police force police,,20803,kentucky lemon law louisville lexington tennessee lime juice enforcement,,20803,louisville lexington tennessee lime juice enforcement,0.0,20803,kentucky lemon law louisville tennessee lime juice legal,0.0023,20803,louisville tennessee lime juice legal,0.0,20803,kentucky lemon law Kentucky Lemon law,,24991,Dictionary of American Naval Fighting Ships Naval warfare Combat Navy,,20803,kentucky lemon law police,,20803,kentucky lemon police,0.0315,20803,kentucky lemon law,0.3764,20803,kentuck lemon law,0.0058,20803,kentucky lemon law,0.3764,20803,kentucki lemon law,0.3764,20803,kentucki lemon law,0.3764,20803,kentucky lemon law,0.3764,20803,kent lemo law,0.0,20803,kentu lemon law,0.0103,20803,motor buyer consum manufactur lemon car kentucki shall law vehicl,0.2727,20803,kentucky lemon law,0.3764,20803,kentucky lemon law,0.3764,20803,kentucky lemon law,0.3764
20805,simmons and rockwell,0.0,20805,simmons rockwell,0.0,20805,simmons rockwell,,20805,simmons rockwell Norman Rockwell,,20805,simmons Norman Rockwell,,20805,simmons rockwell vaughn bradshaw mcmanus eastman theodore dillon,,20805,vaughn bradshaw mcmanus eastman theodore dillon,0.0,20805,simmons rockwell http   www co mo md us srivalo http   www nwguild org http   www co mo md us,0.0,20805,http   www co mo md us srivalo http   www nwguild org http   www co mo md us,0.0,20805,simmons rockwell Richard Simmons Rockwell  musician,,25122,Place of birth George Washington,,20805,simmons and rockwell,,20805,simmons and rockwell,0.0,20805,simmon and rockwell,0.0,20805,simmon and rockwel,0.0,20805,simmon and rockwel,0.0,20805,simmon and rockwel,0.0,20805,simmon and rockwel,0.0,20805,simmon and rockwell,0.0,20805,simm and rock,0.0,20805,simmo and rockw,0.0,20805,wishlist eminem newswir auto send press mtv da rockwel simmon announc,0.0,20805,simmons and rockwell,0.0,20805,simmons and rockwell,0.0,20805,simmons rockwell,0.0
20806,solar roof vent,0.049,20806,solar roof vent,0.049,20806,solar roof vent,,20806,solar roof vent ceiling cap air out vent hole volcano,,20806,solar ceiling cap air out vent hole volcano,,20806,solar roof vent photovoltaic non solar rooftop,,20806,photovoltaic non solar rooftop vent,0.0,20806,solar roof vent photovoltaic geothermal walls,0.0,20806,photovoltaic geothermal walls vent,0.0,20806,solar roof vent Building integrated photovoltaics Ventilation  architecture,,,,,20806,solar roof vent,,20806,solar roof vent,0.049,20806,solar roof vent,0.049,20806,sol roof vens,0.0,20806,sol roof vent,0.0207,20806,solar roof vent,0.049,20806,solar roof vent,0.049,20806,solar roof vent,0.049,20806,sola roof vent,0.0295,20806,solar roof vent,0.049,20806,vent attic rion roof solar green greenhous air ventil fan,0.0704,20806,solar roof vent,0.049,20806,solar roof vent,0.049,20806,solar roof vent,0.049
20808,healthy recipes,0.0315,20808,healthy recipes,0.0315,20808,healthy recipes,,20808,healthy recipes,,20808,healthy recipes,,20808,healthy recipes healthier unhealthy cookbook,,20808,healthier unhealthy cookbook,0.016,20808,healthy recipes healthier importantly cookbooks,0.0007,20808,healthier importantly cookbooks,0.0001,20808,healthy recipes Health Recipe,,,,,20808,healthy recipes recipe,,20808,healthy recipe,0.0315,20808,healthy recipe,0.0315,20808,health recip,0.0058,20808,healthy recip,0.0315,20808,healthi recip,0.0315,20808,healthi recip,0.0315,20808,healthy recipe,0.0315,20808,heal reci,0.0,20808,healt recip,0.0,20808,cook technorati recip pumpkin healthi low chines      fat tag,0.001,20808,healthy recipes,0.0315,20808,healthy recipes,0.0315,20808,healthy recipes,0.0315
20809,quality of life measures,0.5076,20809,quality life measures,0.5076,20809,quality life measures,,20809,quality of life measures,,20809,quality of life measures,,20809,quality life measures quantity high quality lives life   life  initiatives,,20809,quantity high quality lives life   life  initiatives,0.0,20809,quality life measures excellent standards lives even steps,0.0082,20809,excellent standards lives even steps,0.0,20809,quality life measures Quality of life Measurement,,,,,20809,quality timbre of life liveliness measures standard,,20809,timbre of liveliness standard,0.0,20809,quality of life measure,0.5076,20809,qu of lif measur,0.0,20809,qual of lif meas,0.0,20809,qualiti of life measur,0.5076,20809,qualiti of life measur,0.5076,20809,quality of life measure,0.5076,20809,qual of life meas,0.0,20809,quali of life measu,0.0,20809,measur crime life patient survei extern green index qualiti decis questionnair canada,0.4523,20809,quality of life measures,0.5076,20809,quality of life measures,0.5076,20809,quality life measures,0.5076
20810,the tides at charleston on staten island,0.0,20810,tides charleston staten island,0.0,20810,tides charleston staten island,,20810,the tides at charleston on staten island,,20810,the tides at charleston on staten island,,20810,tides charleston staten island tidal currents harlem taft delaware rhode nederland regering archipelago,,20810,tidal currents harlem taft delaware rhode nederland regering archipelago,0.0,20810,tides charleston staten island currents savannah s c  bronx brooklyn coast,0.0,20810,currents savannah s c  bronx brooklyn coast,0.0,20810,tides charleston staten island Tide Charleston  South Carolina Island,,,,,20810,the tides tide at charleston on staten island,,20810,the tide at charleston on staten island,0.0,20810,the tide at charleston on staten island,0.0,20810,th tid at charlest on stat island,0.0,20810,the tid at charleston on stat island,0.0,20810,the tide at charleston on staten island,0.0,20810,the tide at charleston on staten island,0.0,20810,the tide at charleston on staten island,0.0,20810,the tide at char on stat isla,0.0,20810,the tides at charl on state islan,0.0,20810,kreischer fl staten    shore tide island charleston road bu,0.0,20810,the tides at charleston on staten island,0.0,20810,the tides at charleston on staten island,0.0,20810,tides charleston staten island,0.0
20812,free email directory,0.2843,20812,free email directory,0.2843,20812,free email directory,,20812,free email directory,,20812,free email directory,,20812,free email directory free  e mail E mail,,20812,free  e mail E mail directory,0.1052,20812,free email directory   giving e mail,0.0597,20812,  giving e mail,0.0,20812,free email directory Webmail Email Directory service,,,,,20812,free spare email electronic mail directory,,20812,spare electronic mail directory,0.0,20812,free email directory,0.2843,20812,fre email director,0.0,20812,fre email direct,0.0,20812,free email directori,0.2843,20812,free email directori,0.2843,20812,free email directory,0.2843,20812,free emai dire,0.0,20812,free email direc,0.0014,20812,yahoo finder grati indirizzi lookup indirizzo email revers submit directori elettronica posta free,0.0241,20812,free email directory,0.2843,20812,free email directory,0.2843,20812,free email directory,0.2843
20815,dreamland inc,0.0019,20815,dreamland inc,0.0019,20815,dreamland inc,,20815,dreamland inc dreamworld never never land Iraqi National Congress,,20815,dreamworld never never land Iraqi National Congress,,20815,dreamland inc dreamworld fantasyland dream world inc  ltd co,,20815,dreamworld fantasyland dream world inc  ltd co,0.0,20815,dreamland inc kd   ooooooooooooooooooooooooooooooooooooooo  ukqec oly      basket,0.0002,20815,kd   ooooooooooooooooooooooooooooooooooooooo  ukqec oly      basket,0.0,20815,dreamland inc Dreamland  Doctor Who,,,,,20815,dreamland never never land inc iraqi national congress,,20815,never never land iraqi national congress,0.0,20815,dreamland inc,0.0019,20815,dreamland inc,0.0019,20815,dreamland int,0.0003,20815,dreamland inc,0.0019,20815,dreamland inc,0.0019,20815,dreamland inc,0.0019,20815,drea inc,0.0,20815,dream inc,0.0,20815,amateur usa dream club movi inc robert album dreamland occup plant,0.0,20815,dreamland inc,0.0019,20815,dreamland inc,0.0019,20815,dreamland inc,0.0019
20816,credit card debt consolidation loan,0.0,20816,credit card debt consolidation loan,0.0,20816,credit card debt consolidation loan,,20816,credit card debt consolidation loan,,20816,credit card debt consolidation loan,,20816,credit card debt consolidation loan debit get out of jail free indebtedness reorganization repayment,,20816,debit get out of jail free indebtedness reorganization repayment,0.0,20816,credit card debt consolidation loan loans banks debit repay restructuring lenders,0.0,20816,loans banks debit repay restructuring lenders,0.0,20816,credit card debt consolidation loan Credit card Credit card debt Debt consolidation Debt consolidation,,,,,20816,credit recognition card wag debt consolidation loan,,20816,recognition wag debt consolidation loan,0.0,20816,credit card debt consolidate loan,0.0,20816,credit card debt consolis loan,0.0,20816,credit card debt consolid loan,0.0,20816,credit card debt consolid loan,0.0,20816,credit card debt consolid loan,0.0,20816,credit card debt consolidation loan,0.0,20816,cred card debt cons loan,0.0,20816,credi card debt conso loan,0.0,20816,debt uk card credit bad counsel consolid loan mortgag bill,0.0,20816,credit card debt consolidation loan,0.0,20816,credit card debt consolidation loan,0.0,20816,credit card debt consolidation loan,0.0
